{"adapter":"relational_bundle","dataset_id":"synthetic-relational-v1","development_policy":{"folds":5,"seed":20260906},"group_key":"source_group","input_domain":"RLB1 checked lexical relational bundles","limits":{"memory_bytes":2147483648,"output_bytes":134217728,"threads":1,"timeout_seconds":20},"objective":{"decode_floor_bytes_per_second":null,"deployment_canonical_bytes":100000000,"encode_floor_bytes_per_second":100000000,"rank_by":"deployment_total_bytes"},"public_manifest":"manifest.json","schema_version":1,"scope":"Two tiny synthetic movie databases. Not a corpus benchmark.","search_budget":{"candidate_evaluations":30,"wall_seconds":7200},"timing_policy":{"noise_relative_mad_limit":0.1,"role":"smoke","warmup_trials":0},"workload":"static_relational"}
